{
  "format": "lnclass.essentials",
  "version": 1,
  "course": "les-alcools-2",
  "essentials": [
    {
      "name": "Reconnaître, nommer et classer un alcool",
      "subtitle": "Le groupe hydroxyle, les règles de nomenclature et les trois classes d'alcools",
      "content": "<h2>Ce que tu vas savoir faire</h2><ul><li>Reconnaître un alcool grâce à son groupe hydroxyle.</li><li>Nommer un alcool à partir de sa formule semi-développée, et écrire la formule à partir du nom.</li><li>Déterminer la classe d'un alcool : primaire, secondaire ou tertiaire.</li></ul><h2>L'image pour comprendre</h2><p><strong>1. Le maillot des supporters (reconnaître un alcool).</strong> Au stade, les supporters des Éléphants portent tous le maillot orange. Il y a des grands, des petits, des gros, des minces. Mais le maillot suffit pour savoir dans quel camp ils sont.</p><p><em>Le pont.</em> Le maillot, c'est le <strong>groupe hydroxyle</strong> $\\mathrm{{-}OH}$ (un atome d'oxygène lié à un atome d'hydrogène). Le supporter, grand ou petit, c'est la <strong>chaîne carbonée</strong> (l'enchaînement des atomes de carbone). Toute molécule qui « porte le maillot » $\\mathrm{{-}OH}$ au bon endroit est un alcool, quelle que soit la taille de sa chaîne.</p><p><em>La limite de l'image.</em> Le maillot doit être porté par un carbone <strong>tétragonal</strong>, c'est-à-dire un carbone lié à quatre atomes par des liaisons simples. Dans l'acide éthanoïque $\\mathrm{CH_3{-}COOH}$, il y a un $\\mathrm{{-}OH}$, mais son carbone porte aussi une double liaison avec un oxygène : ce n'est pas un alcool.</p><p><strong>2. La rue et la maison (nommer un alcool).</strong> Pour qu'un taxi te dépose chez toi, tu donnes le nom de la rue, puis « c'est la deuxième maison ». Tu comptes les maisons à partir du bout de la rue le plus proche de chez toi, sinon le chauffeur se perd.</p><p><em>Le pont.</em> La rue, c'est la <strong>chaîne principale</strong>. Ta maison, c'est le carbone qui porte $\\mathrm{{-}OH}$. Compter depuis le bout le plus proche, c'est <strong>numéroter la chaîne</strong> pour donner au carbone qui porte $\\mathrm{{-}OH}$ le plus petit numéro possible.</p><p><em>La limite de l'image.</em> La rue choisie doit passer devant ta maison : la chaîne principale est la plus longue chaîne <strong>qui contient le carbone portant</strong> $\\mathrm{{-}OH}$, même si une autre chaîne est plus longue.</p><p><strong>3. La table du maquis (trouver la classe).</strong> Au maquis, une table a quatre chaises. Sur une chaise est toujours assis le même client : $\\mathrm{{-}OH}$. Sur les trois autres chaises, il y a soit des « grands », soit des « petits ». Pour connaître la classe de la table, tu comptes seulement les grands assis autour.</p><p><em>Le pont.</em> La table, c'est le <strong>carbone fonctionnel</strong> (le carbone qui porte $\\mathrm{{-}OH}$). Les quatre chaises, ce sont ses quatre liaisons. Les grands sont les <strong>atomes de carbone</strong> liés à lui, les petits sont les <strong>atomes d'hydrogène</strong>. Un grand : alcool primaire. Deux grands : alcool secondaire. Trois grands : alcool tertiaire.</p><p><em>La limite de l'image.</em> On ne compte que les carbones assis <strong>à la table</strong>, donc liés directement au carbone fonctionnel, pas ceux plus loin dans la chaîne. Le méthanol $\\mathrm{CH_3{-}OH}$ n'a aucun grand à sa table : c'est un cas à part, qui se comporte comme un alcool primaire.</p><h2>Ce qu'il faut retenir</h2><blockquote><p><strong>Alcool.</strong> Un alcool est un composé organique dans lequel un groupe hydroxyle $\\mathrm{{-}OH}$ est lié à un atome de carbone tétragonal. Les alcools saturés non cycliques à un seul groupe $\\mathrm{{-}OH}$ ont pour formule brute $\\mathrm{C_nH_{2n+2}O}$, qu'on écrit aussi $\\mathrm{C_nH_{2n+1}{-}OH}$.</p><p><strong>Nom.</strong> 1) Choisir la chaîne carbonée la plus longue qui contient le carbone fonctionnel. 2) La numéroter pour que le carbone fonctionnel ait le plus petit numéro. 3) Remplacer le « e » final du nom de l'alcane par « -ol », précédé du numéro du carbone fonctionnel. 4) Placer devant les ramifications (groupes alkyles comme méthyl, éthyl) avec leur numéro.</p><p><strong>Classe.</strong> Elle dépend du nombre d'atomes de carbone liés au carbone fonctionnel.</p><ul><li><strong>Primaire</strong> : le carbone fonctionnel est lié à 1 carbone. Forme $\\mathrm{R{-}CH_2{-}OH}$, exemple $\\mathrm{CH_3{-}CH_2{-}OH}$ (éthanol).</li><li><strong>Secondaire</strong> : il est lié à 2 carbones. Forme $\\mathrm{R{-}CH(OH){-}R'}$, exemple $\\mathrm{CH_3{-}CH(OH){-}CH_3}$ (propan-2-ol).</li><li><strong>Tertiaire</strong> : il est lié à 3 carbones. Forme $\\mathrm{R{-}C(OH)(R'){-}R''}$, exemple $\\mathrm{(CH_3)_3C{-}OH}$ (2-méthylpropan-2-ol).</li></ul><p>R, R' et R'' désignent des groupes alkyles, c'est-à-dire des morceaux de chaîne carbonée.</p></blockquote><h2>Exemple résolu</h2><p>Nomme l'alcool $\\mathrm{CH_3{-}C(CH_3)(OH){-}CH_2{-}CH_3}$ et donne sa classe.</p><ol><li><strong>Repérer le carbone fonctionnel.</strong> C'est le deuxième carbone en partant de la gauche : il porte $\\mathrm{{-}OH}$.</li><li><strong>Choisir la chaîne principale.</strong> La plus longue chaîne qui contient ce carbone compte 4 carbones : $\\mathrm{CH_3{-}C{-}CH_2{-}CH_3}$. Le $\\mathrm{CH_3}$ écrit entre parenthèses est une ramification méthyle. La chaîne principale dérive donc du butane.</li><li><strong>Numéroter.</strong> De gauche à droite, le carbone fonctionnel porte le numéro 2. De droite à gauche, il porterait le numéro 3. On garde le plus petit : 2.</li><li><strong>Écrire le nom.</strong> Butane devient butan-2-ol. La ramification méthyle est aussi sur le carbone 2. Le nom est donc <strong>2-méthylbutan-2-ol</strong>.</li><li><strong>Trouver la classe.</strong> Le carbone fonctionnel est lié à trois carbones : le carbone 1, la ramification méthyle et le carbone 3. Trois « grands » à la table : l'alcool est <strong>tertiaire</strong>.</li></ol><h2>Le piège à éviter</h2><p>Beaucoup d'élèves lisent le chiffre du nom comme la classe : « butan-<strong>2</strong>-ol, donc secondaire ». C'est faux en général. Le 2-méthylpropan-2-ol porte aussi un « 2 », mais il est <strong>tertiaire</strong>. Le chiffre donne la <em>position</em> du $\\mathrm{{-}OH}$ dans la chaîne. La classe se trouve seulement en comptant les carbones liés au carbone fonctionnel.</p><p>Pour repérer l'erreur : avant de donner une classe, entoure le carbone fonctionnel et compte les carbones qui le touchent directement.</p><h2>En une phrase</h2><p>Un alcool, c'est un $\\mathrm{{-}OH}$ accroché à un carbone qui n'a que des liaisons simples ; on le nomme en remplaçant le « e » de l'alcane par « -ol », et sa classe, c'est le nombre de carbones voisins du carbone qui porte $\\mathrm{{-}OH}$.</p>",
      "exercises": [
        {
          "title": "Comprendre — Reconnaître un alcool et sa classe",
          "exercise_type": "fixation",
          "questions": [
            {
              "content": "Qu'est-ce qui fait qu'une molécule est un alcool ?",
              "question_type": "single_choice",
              "explanation": "Un alcool possède un groupe hydroxyle $\\mathrm{{-}OH}$ lié à un carbone tétragonal (quatre liaisons simples). C'est le « maillot » porté par le bon joueur. Avoir un $\\mathrm{{-}OH}$ ne suffit pas : dans l'acide éthanoïque $\\mathrm{CH_3{-}COOH}$, le $\\mathrm{{-}OH}$ est sur un carbone qui a une double liaison avec un oxygène, ce n'est donc pas un alcool.",
              "answers": [
                {
                  "content": "Un groupe hydroxyle $\\mathrm{{-}OH}$ lié à un atome de carbone tétragonal.",
                  "correct": true
                },
                {
                  "content": "La présence d'un groupe $\\mathrm{{-}OH}$, peu importe l'atome qui le porte.",
                  "correct": false
                },
                {
                  "content": "La présence d'au moins un atome d'oxygène dans la molécule.",
                  "correct": false
                },
                {
                  "content": "La présence d'une double liaison entre un carbone et un oxygène.",
                  "correct": false
                }
              ]
            },
            {
              "content": "Parmi ces molécules, lesquelles sont des alcools ?",
              "question_type": "multiple_correct_2",
              "explanation": "$\\mathrm{CH_3{-}CH_2{-}OH}$ (éthanol) et $\\mathrm{CH_3{-}CH(OH){-}CH_3}$ (propan-2-ol) ont un $\\mathrm{{-}OH}$ sur un carbone tétragonal. $\\mathrm{CH_3{-}COOH}$ a bien un $\\mathrm{{-}OH}$, mais son carbone est doublement lié à un oxygène : c'est un acide carboxylique. $\\mathrm{CH_3{-}O{-}CH_3}$ contient de l'oxygène, mais aucun groupe $\\mathrm{{-}OH}$. $\\mathrm{CH_3{-}CHO}$ est un aldéhyde.",
              "answers": [
                {
                  "content": "$\\mathrm{CH_3{-}CH_2{-}OH}$",
                  "correct": true
                },
                {
                  "content": "$\\mathrm{CH_3{-}CH(OH){-}CH_3}$",
                  "correct": true
                },
                {
                  "content": "$\\mathrm{CH_3{-}COOH}$",
                  "correct": false
                },
                {
                  "content": "$\\mathrm{CH_3{-}O{-}CH_3}$",
                  "correct": false
                },
                {
                  "content": "$\\mathrm{CH_3{-}CHO}$",
                  "correct": false
                }
              ]
            },
            {
              "content": "Le carbone fonctionnel d'un alcool, c'est :",
              "question_type": "single_choice",
              "explanation": "Le carbone fonctionnel est le carbone qui porte le groupe $\\mathrm{{-}OH}$ : c'est la « table » du maquis où est assis le client $\\mathrm{{-}OH}$. Ce n'est pas forcément le carbone n°1 : dans le propan-2-ol, c'est le carbone du milieu.",
              "answers": [
                {